915,1341,"PAMBA AT THAKAZHY, KERALA",KERALA,27.8,6.7,6.8,76,1.2,1.21,310,625,2011
916,1565,"PAMBA DOWN, KERALA",KERALA,28.3,6.7,6.6,64,0.9,1.35,428,838,2011
917,17,PERIYAR NEAR ALWAYENANELOOR,KERALA,27.5,5.6,6.9,943,1.5,0.4,655,1925,2011
918,18,"PERIYAR AT KALADY, KERALA",KERALA,26.3,7.4,7,38,0.9,0.26,386,1196,2011
919,1338,"PERIYAR AT SEWAGE DISCHARGE POINT, KERALA",KERALA,27,6.7,6.9,43,1,0.3,1043,2750,2011
920,2333,RIVER PERIYAR AT MUPPATHADAM,KERALA,27.4,7.1,7.3,48,1.5,0.36,595,1775,2011
921,2334,RIVER PERIYAR AT PATHALAM,KERALA,27,6.2,6.8,309,1.6,0.39,1129,2725,2011
922,2335,R PERIYAR AT KALAMASSERY,KERALA,27.4,5.2,6.8,61,1.8,0.33,1123,2650,2011
923,2336,R PERIYAR AT PURAPPALLIKAVU,KERALA,27.3,6.8,6.9,995,1.1,0.24,349,1258,2011
924,2300,R PERUVAMBA AT CHANDAPPURA,KERALA,27,6.8,6.9,52,0.9,0.45,39,198,2011
925,2303,R PULLUR AT PULLUR BR.,KERALA,27.8,6.2,6.6,44,0.7,0.21,715,1630,2011
926,2290,R PUZHACKAL AT PUZHACKAL BRIDGE,KERALA,28.4,4.5,6.5,77,1.1,0.34,400,2675,2011
927,2299,R RAMAPURAM AT RAMAPURAM BRIDGE,KERALA,28.8,4,7,19279,0.9,0.03,98,233,2011
928,2305,R SHRIYA AT ANGADIMOGARU,KERALA,28.8,7,7.4,69,1,0.12,230,660,2011
929,2296,R THALLASSERY AT PATHIPPALAM,KERALA,25.9,6.5,6.8,58,0.5,0.24,303,1026,2011
930,2292,R THIRUR AT THALAKKADATHUR BRIDGE,KERALA,28,4.6,6.9,98,0.6,0.11,168,348,2011
931,2306,R UPPALA AT  UPPALA BR.,KERALA,28.5,6.6,7.3,12327,0.6,0.71,1326,2210,2011
932,1442,"VAMANAPURAM, KERALA",KERALA,28.8,7.1,7,51,1,0.78,750,1700,2011
933,1448,"NAGAVALLI AT THOTAPALLI REGULATOR, A.P.",ANDHRA PRADESH,27.6,6.2,7.5,371,1.1,1.62,3,528,2011
934,2352,"RIVER VAMSHADHARA, KALINGAPATNAM,VIZIANAGARAM",ANDHRA PRADESH,27.6,6.2,7.7,316,1.3,2.41,3,312,2011
935,1444,"KALI AT D/S WEST COAST PAPER MILL, KARNATAKA",KARNATAKA,28.3,7.3,7.1,241,2.9,1.17,100,185,2011
936,2780,"KALI AT U/S OF WCPM, DANDELI, KARNATAKA",KARNATAKA,27.5,7.7,7.4,121,1.4,0.64,378,1255,2011
937,1894,KUMARADHARA NAN U/S OF UPPINAGADY TOWN BEFORE CONFLUENCE WITH RIVER NETHRAVATHI,KARNATAKA,30.5,6.5,7.3,64,1,2.6,236,420,2011
938,1892,NETRAVATHI U/S OF DHARMASTALA AT WATER SUPPLY INTAKE POINT,KARNATAKA,29.5,6.9,7.4,57,1,1.28,46,409,2011
939,2423,"BUDHABALANGA, D/S OF BARIPADA TOWN",ORISSA,22.3,7.5,8,211,1.9,0.39,3005,6858,2011
940,2424,"BUDHABALANGA, D/S OF BARIPADA TOWN",ORISSA,22.3,7.2,8,263,3.7,0.63,6625,14725,2011
941,2425,"RIVER KERANDI(INTAKE WELL OF NALCO REFINARY, HAL, SUNABEDA)",ORISSA,25,7,7.6,111,1.6,0.67,1081,2743,2011
942,2422,"NAGAVALLI AT PENTA U/S, JAYKAYPUR TOWN",ORISSA,25.9,7.5,7.9,205,1.5,1,1615,3542,2011
943,1642,"NAGAVALLI AT JAYKAYPUR D/S, ORISSA",ORISSA,25.9,7.1,7.7,283,2.3,1.73,2882,6692,2011
944,1643,"NAGAVALLI AT RAYAGADA D/S, ORISSA",ORISSA,24.8,7.4,8,263,1.7,0.65,3113,6617,2011
945,1455,"RUSHIKULYA AT GANJAM U/S, ORISSA",ORISSA,27.5,8.1,8,300,2.3,0.45,2272,4569,2011
946,1456,"RUSHIKULYA AT GANJAM D/S, ORISSA",ORISSA,28,7.8,8,13103,2.1,0.59,277,739,2011
947,2426,VANSADHARA AT MUNIGUDA (D/S OF M/S VEDANTAALUMINA PROJECT),ORISSA,25,7.4,8,207,1.5,0.53,1356,2872,2011
948,2427,VANSADHARA AT GUNUPUR (INTERSTATE BOUNDRY),ORISSA,25.8,7.2,8,198,1.4,0.57,677,1850,2011
954,1450,"PALAR AT VANIYAMBADI WATER SUPPLY HEAD WORK, TAMILNADU",TAMIL NADU,28.4,6.3,7.6,830,1.8,0.24,738,2020,2011
957,1023,"GHAGGAR AT MUBARAKPUR REST HOUSE (PATIALA), PUNJAB",PUNJAB,24.8,5.8,7.2,732,8.5,3.83,1089,4838,2011
958,1024,"GHAGGAR AT 100M D/S CONF. WITH R. SARASWATI (PATIALA),PUNJAB",PUNJAB,24,5.6,7.4,1322,15.3,15,16750,41500,2011
959,1295,"GHAGGAR NEAR BANKARPUR,DERA BASSI,PUNJAB",PUNJAB,25,5.4,7.3,809,10,4.2,4278,8975,2011
960,1473,"GHAGGAR AT RATANHERI, D/S OF PATIALA NADI (AFTER CONFL.), PUNJAB",PUNJAB,23.3,5.7,7.3,1103,14.3,13.75,20250,52500,2011
961,1698,GHAGGAR AT D/S CHHATBIR,PUNJAB,25.8,5.7,7.5,906,24,14.18,7863,17625,2011
962,1699,"GHAGGAR AT U/S DHAKANSU NALLAH, PUNJAB",PUNJAB,25.8,3.5,7.4,1064,20,13.2,8000,14500,2011
963,1700,"GHAGGAR AT D/S DHAKANSU NALLAH, PUNJAB",PUNJAB,25.8,3.2,7.6,1197,27.3,19.2,20250,40250,2011
964,1701,GHAGGAR AT D/S JHARMAL NADI,PUNJAB,26,4.7,7.3,1383,32.8,16.4,14388,42875,2011
965,1702,GHAGGAR AT U/S JHARMAL NADI,PUNJAB,26,4.8,7.4,1063,16,5.03,3138,8025,2011
966,1703,"GHAGGAR AT MOONAK, PUNJAB",PUNJAB,24.4,5.3,7.5,1532,18.3,15.8,27000,63500,2011
967,1704,GHAGGAR AT D/S SARDULGARH,PUNJAB,23.4,5.6,7.5,1269,34.5,12.15,22000,60000,2011
968,1705,GHAGGAR AT U/S SARDULGARH,PUNJAB,24.3,5.4,7.4,1194,22,8.3,10000,35000,2011
972,1718,"GAGGAR RIVER WHEN ENTERING IN RAJASTHAN FROM HARYANA NEAR RD NO. 629, RAJASTHAN",RAJASTHAN,28,4.8,7.9,650,3.2,0.68,6,62,2011
973,1719,"GAGGAR RIVER D/S HANUMANGARH NEAR 2 KNJ NAI ABADI, MAKKASR",RAJASTHAN,32,5,7.3,390,2.8,0.14,4,20,2011
974,1871,"RIVER MARKANDA AT PAONTA, DISTT. SIRMOUR, H.P.",HIMACHAL PRADESH,21.4,8.3,7.6,334,1,0.49,9,16,2011
975,2624,MARKANDA U/S KALA AMB,HIMACHAL PRADESH,22.3,8.2,7.7,316,1.2,0.48,11,20,2011
977,2625,MARKANDA D/S KALA AMB/ BOUNDARY OF HARYANA,HIMACHAL PRADESH,22.8,8.3,7.6,304,1.2,0.51,12,20,2011
978,1870,"RIVER SUKHANA AT PARWANOO, DISTT. SOLAN, H.P.",HIMACHAL PRADESH,21.8,5.5,7.6,743,7.6,1.02,81,166,2011
979,2948,"RIVER BANDI AT HEMAWAS DAM, PALI, RAJASTHAN",RAJASTHAN,26.9,5.1,7.8,657,1.7,0.26,6,23,2011
1017,1632,"GANOL RIVER TURA, MEGHALAYA",MEGHALAYA,24.4,7.8,7.2,139,1.9,0.56,263,359,2011
1018,1428,"KHARKHLA NEAR SUTNGA KHLIERIAT,JAINTIA HILLS DT.,MEGHALAYA",MEGHALAYA,21.8,6.5,3.1,489,6.1,0.52,32,47,2011
1019,1631,"MYNTDU RIVER JOWAI, MEGHALAYA",MEGHALAYA,20.8,7.3,7,162,2.2,0.69,2085,2633,2011
1020,1633,SIMSANG RIVER WILLIAMNAGAR,MEGHALAYA,25.2,7.8,7.1,136,1.9,0.52,303,409,2011
1021,1427,UMTREW AT BYRNIHAT EAST,MEGHALAYA,24,7.7,7.1,205,7,0.84,303,461,2011
1022,2050,TLAWNG UPSTREAM AIZAWL,MIZORAM,23.4,8.1,7.1,267,1,0.11,2,12,2011
1023,2051,TLAWNG DOWNSTREAM AIZAWL,MIZORAM,23.4,8,7,278,1.1,0.11,3,18,2011
1024,2052,TUIRIAL UPPER CATCHMENT,MIZORAM,23.2,6.9,7.2,268,1.1,0.11,6,37,2011
1025,2053,TUIRIAL LOWER CATCHMENT,MIZORAM,23.3,6.8,7.1,286,1.3,0.11,8,29,2011
1027,1404,GUMTI AT D/S SOUTH TRIPURA,TRIPURA,28.6,6.3,8,164,3.4,0.3,380,528,2011
1028,1726,"CHANDRAPUR, AGARTALA D/S OF HAORA RIVER, TRIPURA",TRIPURA,28.5,6.6,7.9,196,4.4,0.8,425,648,2011
1029,2459,"DAMANGANGA AT ZARI CAUSE WAY BRIDGE, DAMAN ",DAMAN & DIU,29.9,5.6,7.5,15608,25,18.73,5,5,2010
1037,1860,BALEHWAR KHADI AT N.H. NO. 8,GUJARAT,26,5.1,8.1,533,3.7,0.45,3900,7500,2010
1038,1861,RIVER PURNA ON BRIDGE AT SURATNANNAVSARI HIGHWAY,GUJARAT,27,7.1,8,555,2,0.35,7500,15000,2010
1039,1862,RIVER KAVERI ON BRIDGE AT BILLIMORANANVALSAD ROAD,GUJARAT,27,6.8,8.2,26600,3.1,0.62,9000,23000,2010
1040,1865,RIVER DHADAR AT KOTHADA,GUJARAT,29.3,8.1,7.6,938,8.6,0.4,22,108,2010
1041,1148,"AMBIKA AT BILIMORA, ",GUJARAT,28.4,6.2,7.8,7778,2.7,0.26,2880,6581,2010
1043,1438,"MINDHOLA AT STATE HIGHWAY BRIDGE SACHIN, ",GUJARAT,28.3,3.2,7.7,885,6.3,0.51,3900,9575,2010
1209,1633,SIMSANG RIVER WILLIAMNAGAR,MIZORAM,25,8.23,7.38,143,1.55,3.55,255,360,2010
1215,1404,GUMTI AT D/S SOUTH TRIPURA,tripura,28,6.2,7.7,176,3.5,0.2,532,592,2010
1216,1726,"CHANDRAPUR, AGARTALA D/S OF HAORA RIVER, TRIPURA",tripura,29,6.3,8,198,4.2,0.3,524,686,2010
