298,2672,"KUNDALIKA RIVER AT DHATAV AT JACKWELL (DRINKING WATER  PUMPING STATIONNANSWEET ZONE), ROHA",MAHARASHTRA,26.5,7.3,7.7,86,3.2,1,50,93,2013
299,2168,MITHI RIVER,MAHARASHTRA,27,3.6,7.4,6487,30.5,1.5,534,745,2013
300,2676,"MUCHKUNDI RIVER AT  WAKED,RATNAGIRI, NEAR M/S ASAHI INDIA GLASS LTD., LANJA, RATNAGIRI.",MAHARASHTRA,27.3,6.3,8.3,999,3.3,1.78,4,112,2013
301,1151,"PATALGANGA AT SHILPHATA, MAHARASHTRA",MAHARASHTRA,28.7,7.2,7.7,125,3.3,1,39,89,2013
302,1462,"PATALGANGA NEAR INTAKE OF MIDC W/W, MAHARASHTRA",MAHARASHTRA,28.4,7.1,7.5,127,3.4,4.4,17,63,2013
303,2685,"PATALGANGA RIVER AT D/S OF KHARPADA BRIDGE, RAIGAD.",MAHARASHTRA,28.7,7.1,7.4,5300,38,1,388,667,2013
304,2686,"PATALGANGA RIVER AT VYAL PUMP HOUSE , KHALAPUR, RAIGAD.",MAHARASHTRA,28.7,7.2,7.6,127,3.2,1,22,51,2013
305,2687,"PATALGANGA RIVER AT KHALAPUR PUMPING STATION, KHALAPUR, RAIGAD.",MAHARASHTRA,28.7,7,7.6,126,3.3,1,20,63,2013
306,2688,"PATALGANGA RIVER AT SAVROLI BRIDGE, KHALAPUR, RAIGAD.",MAHARASHTRA,28.7,7.2,7.6,126,3.4,1.89,29,64,2013
307,2689,"PATALGANGA RIVER AT GAGANGIRI MAHARAJ TEMPLE, KHOPOLI, RAIGAD.",MAHARASHTRA,28.7,7.1,7.8,112,3.2,0.63,43,88,2013
308,2199,SAVITRI RIVER AT OVALE VILLAGE.,MAHARASHTRA,29.3,6.8,7.7,9590,3.6,4.57,3,124,2013
309,2701,"SAVITRI RIVER JACKWELL AT UPSA KENDRE, NANGALWADI, MAHAD, RAIGAD",MAHARASHTRA,28.3,6.8,7.4,174,3.7,2.26,4,124,2013
310,2702,"SAVITRI RIVER AT SHEDAV DOH, MAHAD,RAIGAD",MAHARASHTRA,28.7,6.8,7.6,2572,3.3,4.22,4,118,2013
311,2703,"SAVITRI RIVER AT DADLI BRIDGE, DADLI, MAHAD, RAIGADH",MAHARASHTRA,29.2,6.7,7.8,6030,4.4,4.78,4,138,2013
312,2704,"SAVITRI RIVER AT MUTHAVALI VILLAGE, MAHAD, RAIGADH",MAHARASHTRA,28.7,6.8,7.7,7207,3.9,4.25,3,120,2013
313,2706,"SURYA RIVER, U/S OF SURYA DAM, DHAMMI, VIKRAMGAD, THANE",MAHARASHTRA,27.2,6.8,8.1,167,3.8,1,32,85,2013
314,2707,"SURYA RIVER AT MIDC PUMPING STATION, GARVASHET, PALGHAR, THANE",MAHARASHTRA,27.2,6.8,8,173,3.5,1,53,98,2013
315,2708,"SURYA RIVER AT INTAKE OF VASAINANVIRAR W/S SCHEME, MASVAN, PALGHAR, THANE",MAHARASHTRA,27.2,7,8,168,3.6,1,44,83,2013
316,2709,"TANSA RIVER NEAR ROAD BRIDGE, VILLAGE DAKEWALI, WADA, THANE",MAHARASHTRA,28,6.9,7.9,131,3.5,0.75,41,96,2013
317,1094,"ULHAS AT U/S OF BADLAPUR, MAHARASHTRA",MAHARASHTRA,26.2,7,7.6,125,3.5,0.6,33,63,2013
318,2162,ULHAS RIVER ATJAMBHUL WATER WORKS.,MAHARASHTRA,26.2,7.2,7.5,132,3.3,0.9,38,88,2013
319,2712,"VAITARNA RIVER NEAR ROAD BRIDGE, GANDHARE VILLAGE, WADA, THANE.",MAHARASHTRA,28.2,7.2,7.7,119,3.3,1,35,68,2013
320,2164,VASHISTI RIVER AT U/S OF THREE M PAPER MILLS NEAR M/S MULTIFILMS PLASTIC PVT. LTD. AT KHERDI.,MAHARASHTRA,24.5,6.9,7.5,159,2.8,1,3,82,2013
321,2713,"VASHISHTI RIVER AT D/S OF THREE M PAPER MILLS NEAR CHIPLUN WATER INTAKE JACKWELL, KHERDI, RATNAGIRI",MAHARASHTRA,24.5,6.7,7.7,141,3.3,3,4,90,2013
322,2714,"VASHISHTI RIVER AT U/S OF POPHALI NEAR KONPHANSAWANE BRIDGE, CHIPLUN, RATNAGIRI",MAHARASHTRA,24.5,7.3,7.7,132,2.9,2,3,88,2013
323,1342,"ACHENKOIL AT THUMPAMON, KERALA",KERALA,24,6.4,7.3,76,1.7,0.62,199,788,2013
324,1443,"ACHENKOIL AT CHENNITHULA, KERALA",KERALA,24.9,6,7.1,85,1.7,0.53,262,538,2013
325,3465,"ACHENKOIL AT KALLARAKADAVU, PATHANAMTHITTA",KERALA,24.3,6.3,7.1,69,1.3,0.57,248,593,2013
326,3466,"ACHENKOIL AT PANDALAM (NEAR AYYAPPA TEMPLE), PATHANAMTHITTA",KERALA,24.8,6.5,7.3,76,1.6,0.55,226,545,2013
327,2297,R ANCHARAKANDY AT MERUVAMBA,KERALA,26.4,6.7,6.6,60,1.2,0.34,228,435,2013
328,2319,R ANCHARAKANDY AT MERUVAMBA,KERALA,27,7,6.6,3544,1.5,0.37,208,435,2013
329,2286,R AYROOR AT AYROOR BRIDGE,KERALA,26.6,6.7,7.3,51,0.8,0.35,547,1567,2013
330,2331,R BHARATHAPUZHA AT KUTTIPPURAM,KERALA,28.6,6.9,7.7,107,0.7,0.46,255,443,2013
331,2332,R BHARATHAPUZHA AT PATTAMBI,KERALA,28.8,6.7,7.9,173,0.9,0.56,191,426,2013
332,1154,"CHALAKUDY AT PULICKALKANANDAVU, KERALA",KERALA,28,5.6,6.9,126,1.2,0.67,266,990,2013
333,20,"CHALIYAR AT KOOLIMADU, KERALA",KERALA,27.4,7.3,7.4,70,0.8,0.31,2984,4208,2013
334,21,"CHALIYAR AT CHUNGAPALLY, KERALA",KERALA,27.5,6.9,7.4,12754,0.8,0.29,1807,2557,2013
335,3464,"CHALIYAR AT NILAMBUR, MALAPPURAM",KERALA,26.8,7.1,7.4,80,0.6,0.5,1921,2831,2013
336,1572,"CHANDRAGIRI AT PADIYATHADKA, KERALA",KERALA,30,7.2,6.9,62,1.3,0.11,33,150,2013
337,1573,"CHITRAPUZHA AT IRUMPANAM, KERALA",KERALA,28.8,3.4,6.7,2965,2.3,1.11,271,1236,2013
338,2295,R CORAPUZHA AT KANAYANKODE,KERALA,27.4,6.1,7.2,15871,0.9,0.25,1667,2975,2013
339,1564,"R ITHIKKARA AT AYUR, KERALA",KERALA,24.8,6.4,7.2,120,1.9,0.77,258,618,2013
340,2287,R ITHIKKARA AT ITHIKKARA,KERALA,23.6,6.2,7.2,7448,2,1.01,184,483,2013
341,1566,"R KADALUNDI AT THIRURANGADY, KERALA",KERALA,29.8,6.6,6.9,77,1.6,0.29,264,756,2013
342,2293,R KADALUNDI AT HAJIRAPPALLY,KERALA,30.2,6.8,7,72,1.7,0.2,249,785,2013
343,2337,R KADAMBAYAR AT BRAHMAPURAM,KERALA,28.2,2.9,6.7,305,2.2,1.28,403,1623,2013
344,2338,R KADAMBAYAR AT MANCKAKADAVU,KERALA,27.7,3,6.6,86,2,0.39,357,1319,2013
345,42,"KALLADA AT PERUMTHOTTAMKADAVU, PUNALOOR, KERALA",KERALA,23.9,6.7,7.1,79,1.6,0.34,313,738,2013
346,2294,R KALLAI AT KALLAI BRIDGE,KERALA,27.4,3.6,7.3,32790,2.6,0.59,64259,112867,2013
347,3460,"KALPATHI PUZHA AT KALPATHI, PALAKKAD",KERALA,27.8,6.1,7.8,2905,1.3,0.54,422,997,2013
348,3458,KARAPUZHA DAM AT WAYANAD,KERALA,26.4,6.9,7.4,112,0.5,0.35,50,67,2013
349,1571,"R KARINGODE AT KAKKADAVU,  KERALA",KERALA,29.6,7,6.9,51,1.1,0.18,44,317,2013
350,1155,"KARAMANA AT MOONNATTUMUKKU, KERALA",KERALA,27,3.1,7.2,1416,13.2,4.41,2992,19917,2013
351,3471,"RIVER KARAMANA AT ARUVIKARA, THIRUVANANTHAPURAM",KERALA,26.3,7,7.1,30,0.5,0.32,211,496,2013
352,2289,R KARUVANNURR AT KARUVANNUR BRIDGE,KERALA,30,6.1,7,59,1.8,0.58,89,282,2013
353,2301,R KAVVAI AT KUTTIYOL PALAM,KERALA,28,6,6.4,61,2.1,0.28,87,300,2013
354,2291,R KEECHERI AT VADAKKANCHERY BRIDGE,KERALA,30.1,6.3,7,105,2.8,0.37,142,543,2013
355,2326,R KORAYAR AT KANJIKODE,KERALA,27.9,6.9,8.1,502,0.9,0.72,382,615,2013
356,1569,"R KUPPAM AT THALIPARAMBA, KERALA",KERALA,27,5.9,6.7,14662,1.5,0.52,144,377,2013
357,2298,R KUPPAM AT RAYAROM,KERALA,26,7.8,6.8,49,1.4,0.3,122,319,2013
358,1567,"R KUTTIYADE AT KUTTIYADY ESTATE, KERALA",KERALA,27.7,7.1,7.4,380,1,0.14,1527,66382,2013
359,1568,"R MAHE AT VALAYAM, KERALA",KERALA,27.1,7.3,7.2,67,0.9,0.38,6490,3471,2013
360,2285,R MAMOM AT MAMOM BRIDGE,KERALA,26.5,6.2,7.2,51,0.8,0.23,331,942,2013
361,1340,"MANIMALA  AT KALLOOPARA, KERALA",KERALA,28.5,7.2,6.8,69,1.2,0.45,706,941,2013
362,1384,"MANIMALA AT THONDRA, KERALA",KERALA,28.7,6.9,6.7,75,2.5,0.4,526,701,2013
363,3459,"MANIYANKODE PUZHA AT MANIYANKODE BRIDGE, WAYANAD",KERALA,25.7,6.3,7.4,113,0.6,0.88,98,128,2013
364,2307,R MANJESWAR AT BAJRAKKARA BR.,KERALA,29.3,7.6,6.8,79,1.6,0.31,48,109,2013
365,1339,"MEENACHIL AT KIDANGOOR, KERALA",KERALA,27,7,7.2,57,0.6,0.46,2117,3558,2013
366,2304,R MOGRAL AT MOGRAL BR.,KERALA,30.9,5.9,7,22576,1.5,0.35,42,253,2013
367,43,"MUVATTAPUZHA AT VETTIKKATTUMUKKU, KERALA",KERALA,27.1,6.8,7.2,105,0.6,0.39,1200,2392,2013
368,2302,R NEELASWARAM AT NAMBIARKAL DAM,KERALA,30.3,6.3,6.7,2315,1.3,0.17,55,278,2013
369,1570,"R NEELESWARAM AT HOSDURG, KERALA",KERALA,30.4,6.4,6.9,18569,1,0.27,40,277,2013
370,1563,"R NEYYAR AT AMARAVILA, KERALA",KERALA,26.2,6.6,7.3,45,0.6,0.39,228,940,2013
371,2284,R NEYYAR AT ARUVIPURAM,KERALA,26.2,6.9,7.2,42,0.5,0.18,151,774,2013
372,2288,R PALLICKAL AT NELLIMUKAL,KERALA,25.1,6,7.3,92,1.7,0.56,256,597,2013
373,1156,"PAMBA AT CHENGANNUR, KERALA",KERALA,27.4,6.1,7.2,59,0.7,1.04,181,311,2013
374,1341,"PAMBA AT THAKAZHY, KERALA",KERALA,28.1,4.5,6.9,1190,0.7,1.17,218,388,2013
375,1565,"PAMBA DOWN, KERALA",KERALA,28.3,4.2,7,69,0.6,1.04,240,420,2013
376,17,"PERIYAR NEAR ALWAYENANELOOR, KERALA",KERALA,28.2,6,7,5569,2.2,0.68,473,1894,2013
377,18,"PERIYAR AT KALADY, KERALA",KERALA,27.2,7.3,7,34,1,0.27,234,927,2013
378,1338,"PERIYAR AT SEWAGE DISCHARGE POINT, KERALA",KERALA,27.4,6.3,7,44,1.6,0.32,487,1876,2013
379,2333,RIVER PERIYAR AT MUPPATHADAM,KERALA,28.2,6.4,7.2,49,1.4,0.23,362,1357,2013
380,2334,RIVER PERIYAR AT PATHALAM,KERALA,27.9,5.9,7,3272,2.2,0.62,330,1284,2013
381,2335,R PERIYAR AT KALAMASSERY,KERALA,27.3,4.6,7,65,1.7,0.28,631,1937,2013
382,2336,R PERIYAR AT PURAPPALLIKAVU,KERALA,28.2,6.5,6.9,4650,2,1,340,1573,2013
383,3468,"PERIYAR AT KWA INTAKENAN ALUVA, ERNAKULAM",KERALA,28.2,6.5,7,42,1.4,1,249,1221,2013
384,2300,R PERUVAMBA AT CHANDAPPURA,KERALA,26.7,6.4,6.4,45,1.2,1,142,376,2013
385,2303,R PULLUR AT PULLUR BR.,KERALA,28,6,6.1,56,1.2,0,136,438,2013
386,2290,R PUZHACKAL AT PUZHACKAL BRIDGE,KERALA,29.7,5.3,6.8,99,2.8,0.79,106,523,2013
387,2299,R RAMAPURAM AT RAMAPURAM BRIDGE,KERALA,28.2,3.6,6.5,22131,1.8,0.95,105,261,2013
388,2305,R SHRIYA AT ANGADIMOGARU,KERALA,28.9,6.9,6.7,66,1.8,0,93,205,2013
389,2296,R THALLASSERY AT PATHIPPALAM,KERALA,26.4,6,6.6,67,1.5,3.69,168,398,2013
390,2292,R THIRUR AT THALAKKADATHUR BRIDGE,KERALA,30,4.9,6.8,9107,1.6,1,208,614,2013
391,2306,R UPPALA AT  UPPALA BR.,KERALA,30.8,6.3,7,18931,1.4,1,34,201,2013
392,3473,"RIVER VALAPATTANAM AT PARASSINIKADAVU, KANNUR",KERALA,27.8,6.6,6.8,15525,1.1,0.06,149,347,2013
393,1442,"VAMANAPURAM, KERALA",KERALA,26.7,7.1,7.5,46,0.8,1,239,1097,2013
394,1448,"NAGAVALLI AT THOTAPALLI REGULATOR, A.P.",ANDHRA PRADESH,27,6,7.3,432,1.2,3,3,78,2013
395,2352,"RIVER VAMSHADHARA, KALINGAPATNAM,VIZIANAGARAM",ANDHRA PRADESH,26.8,6.1,7.7,328,1.2,1,3,211,2013
396,3080,"U/S OF KARAKAVAGU AT PALONCHA,  KHAMMAM, A.P.",ANDHRA PRADESH,19,5.8,7.8,707,0.6,0.85,2,1100,2013
397,3081,"D/S OF KARAKAVAGU AT PALONCHA,  KHAMMAM, A.P.",ANDHRA PRADESH,21.4,6.1,8,674,0.9,1,2,1260,2013
398,1444,"KALI AT D/S WEST COAST PAPER MILL, KARNATAKA",KARNATAKA,27.1,7.3,7.3,164,2.3,1,115,336,2013
399,2780,"KALI AT U/S OF WCPM, DANDELI, KARNATAKA",KARNATAKA,26.3,7.6,7.4,122,2.4,1,223,834,2013
400,1894,KUMARADHARA NAN U/S OF UPPINAGADY TOWN BEFORE CONFLUENCE WITH RIVER NETHRAVATHI,KARNATAKA,28.3,6.5,7.1,95,1,0,156,212,2013
401,1892,NETRAVATHI U/S OF DHARMASTALA AT WATER SUPPLY INTAKE POINT,KARNATAKA,27.9,6.5,7.1,56,1,0,30,79,2013
402,2423,"BUDHABALANGA, D/S OF BARIPADA TOWN",ORISSA,23.4,7.5,7.8,237,1.4,0.89,8281,18918,2013
403,2424,BUDHABALANGA AT BALASORE D/S,ORISSA,23.5,7.6,7.6,3688,2.3,2.66,19264,32918,2013
404,2425,"RIVER KERANDI(INTAKE WELL OF NALCO REFINARY, HAL, SUNABEDA)",ORISSA,22.4,7.3,7.5,82,1.2,1.58,15816,17512,2013
405,2422,"NAGAVALLI AT PENTA U/S, JAYKAYPUR TOWN",ORISSA,26.8,7.5,8,202,1.4,1.89,11771,23191,2013
406,1642,"NAGAVALLI AT JAYKAYPUR D/S, ORISSA",ORISSA,26.5,7.3,7.9,232,2.9,2.23,9026,30836,2013
407,1643,"NAGAVALLI AT RAYAGADA D/S, ORISSA",ORISSA,22,7.4,7.9,246,2.3,1.9,1850,3900,2013
408,1455,"RUSHIKULYA AT GANJAM U/S, ORISSA",ORISSA,27.6,6.9,8.1,3960,2,2.26,19058,22523,2013
409,1456,"RUSHIKULYA AT GANJAM D/S, ORISSA",ORISSA,26.8,7,8,28222,1.8,2.54,16613,10469,2013
410,2426,VANSADHARA AT MUNIGUDA (D/S OF M/S VEDANTAALUMINA PROJECT),ORISSA,25.6,7.2,7.8,201,1.3,1.59,29937,31034,2013
411,2427,VANSADHARA ATGUNUPUR (INTERSTATE BOUNDRY),ORISSA,26.5,7.3,8,221,1.2,2.26,16103,5289,2013
417,1450,"PALAR AT VANIYAMBADI WATER SUPPLY HEAD WORK, TAMILNADU",TAMILNADU,27.8,6.7,7.5,1088,1.7,0,194,474,2013
418,1159,"TAMBIRAPARANI AT BDG.NR. MADURA COATS LTD.PAPAVINASAM,TAMILNADU",TAMILNADU,23.4,7.2,6.5,73,3.1,0,19,59,2013
419,1160,"TAMBIRAPARANI AT CHERANMADEVI,CAUSE WAY,TAMILNADU",TAMILNADU,25.4,6.7,6.3,98,3.3,1.5,21,74,2013
420,1161,"TAMBIRAPARANI AT TIRUNELVELI,COLLECTORATE,TAMILNADU.",TAMILNADU,26.3,6.3,6.5,143,4,4,38,124,2013
421,1162,"TAMBIRAPARANI AT MURAPPANADU, TAMILNADU",TAMILNADU,29,6.6,6.9,260,5.4,1,17,53,2013
422,1328,"TAMBIRAPARANI AT PAPPANKULAM,TAMILNADU",TAMILNADU,24.6,7.1,6.3,71,3.5,1,24,82,2013
423,1329,"TAMBIRAPARANI AT RAIL BDG. NR. AMBASAMUDAM, TAMILNADU",TAMILNADU,23.5,6.9,6.3,65,3.5,0,17,52,2013
424,1330,"TAMBIRAPARANI AT ARUMUGANERI, TAMILNADU",TAMILNADU,29,7.3,7.1,607,3.6,0.88,33,104,2013
425,3025,"TAMBIRAPARANI AT ERAL, THOTHUKUDI, TAMILNADU",TAMILNADU,27,6.1,7,446,5.2,0.56,26,77,2013
426,3026,"TAMBIRAPARANI AT KALLIDAI KURICHI, TIRUNELVELI, TAMILNADU",TAMILNADU,24,6.9,6.4,94,3.2,1.59,20,65,2013
427,3027,"TAMBIRAPARANI AT SRIVAIKUNTAM, D/S OF SK ANAICUT, TIRUNELVELI, TAMILNADU",TAMILNADU,28.7,6.8,6.8,451,9.4,0.55,22,58,2013
428,3028,"TAMBIRAPARANI AT VELLAKOIL, TIRUNELVELI, TAMILNADU",TAMILNADU,26.3,6,6.6,169,3.9,2,22,84,2013
429,3029,"TAMBIRAPARANI AT SIVALAPERI, CONFLUENCE POINT OF KUTTRALAM FALLS, D/S OF PALAYAMKOTTAI, TIRUNELVELI, TAMILNADU",TAMILNADU,25.7,6.5,6.7,187,3.3,3,32,113,2013
430,3023,"VASISTA AT SALEM, D/S OF SAGO INDUSRIES EFFLUENT, TAMILNADU",TAMILNADU,26.8,3.4,7.8,2577,164.9,1.5,148825783,160405392,2013
432,1023,"GHAGGAR AT MUBARAKPUR REST HOUSE (PATIALA), PUNJAB",PUNJAB,23.3,5.5,7.2,636,9.7,4,1328,4975,2013
433,1024,"GHAGGAR AT 100M D/S CONF. WITH R. SARASWATI (PATIALA),PUNJAB",PUNJAB,22.8,4.7,7.3,1088,23.8,4,28250,56000,2013
434,1295,"GHAGGAR NEAR BANKARPUR,DERA BASSI,PUNJAB",PUNJAB,23.3,5.3,7.2,689,11.3,4,1350,6025,2013
435,1473,"GHAGGAR AT RATANHERI, D/S OF PATIALA NADI (AFTER CONFL.), PUNJAB",PUNJAB,21.8,4.9,7.3,1267,23.5,3,24750,54250,2013
436,1698,"D/S CHHATBIR, PUNJAB",PUNJAB,24.3,5.3,7.4,852,13,4,13775,26750,2013
437,1699,"U/S DHAKANSU NALLAH, PUNJAB",PUNJAB,23.5,4.9,7.5,977,16.5,5,12375,30500,2013
438,1700,"D/S DHAKANSU NALLAH, PUNJAB",PUNJAB,24,4.4,7.4,1256,24.8,6,25250,55250,2013
439,1701,"D/S JHARMAL NADI, PUNJAB",PUNJAB,23.5,4.8,7.2,1021,20.3,4,22875,43700,2013
440,1702,"U/S JHARMAL NADI, PUNJAB",PUNJAB,23.3,5.1,7.3,971,14.8,5,2125,8425,2013
441,1703,"GHAGGER AT MOONAK, PUNJAB",PUNJAB,22.5,4.6,7.4,1284,24.3,4,21500,50000,2013
442,1704,"D/S SARDULGARH, PUNJAB",PUNJAB,26,4,7.4,1096,26,3,31750,57500,2013
443,1705,"U/S SARDULGARH, PUNJAB",PUNJAB,25.8,4.4,7.3,1002,21.5,4,21000,43750,2013
448,1718,"GAGGAR RIVER WHEN ENTERING IN RAJASTHAN FROM HARYANA NEAR RD NO. 629, RAJASTHAN",RAJASTHAN,30.7,4.8,7.6,295,0.8,0,4,9,2013
449,1871,"RIVER MARKANDA AT PAONTA, DISTT. SIRMOUR, H.P.",HIMACHAL PRADESH,20.3,7.1,7.5,293,1.3,0,9,19,2013
450,2624,MARKANDA U/S KALA AMB,HIMACHAL PRADESH,20.7,7.1,7.5,316,1.4,0,13,22,2013
451,2625,MARKANDA D/S KALA AMB/ BOUNDARY OF HARYANA,HIMACHAL PRADESH,20.8,6.6,7.5,274,1.6,0,14,24,2013
452,1870,"RIVER SUKHANA AT PARWANOO, DISTT. SOLAN, H.P.",HIMACHAL PRADESH,20.6,4.9,7.4,407,16.3,0,51,120,2013
453,2947,"RIVER JAWAI AT JAWAI DAM, SIROHI, RAJASTHAN",RAJASTHAN,28,4.9,8.3,603,1,0,4,5,2013
454,1717,"KODRA DAM, MOUNT ABU, RAJASTHAN",RAJASTHAN,23.4,5.5,7.4,138,0.8,0,4,6,2013
455,2948,"RIVER BANDI AT HEMAWAS DAM, PALI, RAJASTHAN",RAJASTHAN,25.3,5.5,8.1,625,1.1,0,4,6,2013
456,1719,"GAGGAR RIVER D/S HANUMANGARH NEAR 2 KNJ NAI ABADI, MAKKASR, RAJASTHAN",RAJASTHAN,31.1,5,7.3,305,1.7,0,4,12,2013
457,2949,"RIVER LUNI AT RANAKPUR DAM, RANAKPUR, PALI, RAJASTHAN",RAJASTHAN,26.3,5.6,8.1,552,1.1,0,4,6,2013
458,3305,"RIVER BANJAR AT MALANJKHAND NEAR W/S INTAKE POINT, JABALPUR",MADHYA PRADESH,22,7.3,7.3,402,2.1,0,4,32,2013
459,3383,"BUGI RIVER AT MIBANPARA, SOUTH GARO HILLS",MEGHALAYA,24.4,7.2,7.3,99,2.2,1,26,57,2013
460,3384,"BUGI RIVER AT DALU, SOUTH GARO HILLS",MEGHALAYA,23.7,7.2,7.4,102,2.2,1,25,56,2013
461,3380,"DAMRING RIVER (KRISHNEI RIVER) AT RESUBELPARA, EAST GARO HILLS",MEGHALAYA,24.6,7.6,7.2,72,1.8,2.56,24,57,2013
462,1632,"GANOL RIVER TURA, MEGHALAYA",MEGHALAYA,23.1,7.1,7.5,131,2.2,3.2,239,413,2013
463,1428,"KYRHUKHLA NEAR SUTNGA KHLIERIAT,JAINTIA HILLS DT.,MEGHALAYA",MEGHALAYA,21.7,5.2,2.9,682,7.8,1.5,16,30,2013
464,3369,"KYNSHI RIVER AT SOHIONG, WEST KHASI HILLS",MEGHALAYA,18.2,7.3,7.1,47,1.3,2,15,48,2013
465,3370,"KYNSHI RIVER AT NANGKHNUM, WEST KHASI HILLS",MEGHALAYA,18.8,7.6,7.2,52,1.2,2,16,36,2013
466,3371,"KYNSHI RIVER AT RANIKOR, WEST KHASI HILLS",MEGHALAYA,23.8,8,6.9,64,1.8,3.38,23,49,2013
467,3372,RILANG RIVER,MEGHALAYA,17.8,7.9,7.3,46,1.4,1,12,29,2013
468,3373,WAH BLEI,MEGHALAYA,18.7,7.4,7.2,53,1.9,3,14,32,2013
469,3374,WAH BLEI,MEGHALAYA,18.8,7.7,7.2,55,1.6,3,15,63,2013
470,3375,LUKHA RIVER,MEGHALAYA,21.3,6.8,2.7,1074,3.2,2.33,4,11,2013
471,3376,LUKHA RIVER,MEGHALAYA,22.6,7.1,6.5,237,3.8,4.56,674,1072,2013
472,3381,"MANDA RIVER (DUDHAI RIVER) AT JAMPA, EAST GARO HILLS",MEGHALAYA,25.2,7.8,7.2,50,1.6,1.77,20,41,2013
473,3382,"MANDA RIVER (DUDHAI RIVER) AT WAGAISI, EAST GARO HILLS",MEGHALAYA,24.8,7.3,7.3,71,2,2.66,21,47,2013
474,3377,"MYNTANG RIVER AT NARTIANG, JAYANTIA HILLS",MEGHALAYA,19.9,7.3,7,91,1.8,3.3,20,45,2013
475,3378,"MYNTANG RIVER AT MYNSO, JAYANTIA HILLS",MEGHALAYA,20.7,7.4,7.1,49,1.7,2.44,19,42,2013
476,1631,"MYNTDU RIVER JOWAI, MEGHALAYA",MEGHALAYA,20.6,6.5,7.1,99,2.7,3.56,1967,2722,2013
477,3379,"MYNTDU RIVER AT LESHKA, JAYANTIA HILLS",MEGHALAYA,21.5,7.5,5.7,50,1.5,2.21,10,23,2013
478,3367,"NONBAH RIVER AT NANGSTOIN MARKE, WEST KHASI HILLS",MEGHALAYA,17.7,5.8,6.9,68,3.1,4.9,197,463,2013
479,3368,"NONBAH RIVER AT NANGSTOIN MARKE, WEST KHASI HILLS",MEGHALAYA,17.9,6.9,7.2,44,1.4,2.66,14,33,2013
480,1633,"SIMSANG RIVER WILLIAMNAGAR, MEGHALAYA",MEGHALAYA,23.9,7.8,7.3,93,1.9,2.99,264,444,2013
481,3353,"UMIAM MAWPHLANG RIVER AT NONGKREM, EAST KHASI HILLS",MEGHALAYA,18,6.6,7,66,2.3,4,29,63,2013
482,3354,"UMIAM MAWPHLANG RIVER AT UMTYNGNGAR, EAST KHASI HILLS",MEGHALAYA,18.4,7.6,7.1,53,1.7,3,23,53,2013
483,3355,"UMIAM MAWPHLANG RIVER AT MAWPHLANG, EAST KHASI HILLS",MEGHALAYA,18.8,7.8,7,47,1.4,2,8,35,2013
484,3356,"UMIAM MAWPHLANG RIVER AT SHELLA, EAST KHASI HILLS",MEGHALAYA,24.8,7.7,7.4,128,1.6,3.32,25,56,2013
485,3350,UMKHEN AT WAHKDAIT,MEGHALAYA,19.3,7.1,7,54,1.8,2.58,20,43,2013
486,3351,UMKHEN AT KSEHPONGDENG,MEGHALAYA,20.6,7.4,7,69,1.6,3.3,17,87,2013
487,3352,"UMKHEN RIVER AT DIENGPASOH, EAST KHASI HILLS",MEGHALAYA,20.7,7.5,7.2,58,1.6,2.25,21,46,2013
488,3359,"UMKHRAH RIVER AT DEMTHRING, SHILLONG",MEGHALAYA,18.4,3.1,7.2,401,21.8,19,22556,31444,2013
489,3360,"UMKHRAH RIVER ATUMKALIAR, SHILLONG",MEGHALAYA,19.1,4.7,7.2,202,13.6,15,13444,20056,2013
490,3361,"UMKHRAH RIVER ATMAWLAI, SLAUGHTER",MEGHALAYA,19.7,2.1,7.2,303,37.2,18.2,39444,62333,2013
491,3362,"UMKHRAH RIVER AT MAWPDANG, MAWLAI",MEGHALAYA,20.1,1.8,7.2,394,40.6,15.4,57222,96944,2013
492,3357,"UMNGOT RIVER AT SMIT, EAST KHASI HILLS",MEGHALAYA,17.6,7.2,6.9,55,1.7,3.04,26,56,2013
493,3358,"UMNGOT RIVER AT DAWKI, EAST KHASI HILLS",MEGHALAYA,22.7,7.9,7.1,55,1.2,3.55,23,50,2013
494,3363,"UMSHYRPI RIVER AT RISA COLONY, EAST KHASI HILLS",MEGHALAYA,17.9,6.9,6.9,52,2.2,3.48,1576,45,2013
495,3364,"UMSHYRPI RIVER AT LAW COLLEGE, DHANKETI, EAST KHASI HILLS",MEGHALAYA,18.9,1.9,7,306,34.2,17.9,48278,85667,2013
496,3365,"UMSHYRPI RIVER AT UMSHYRPI BRIDGE, EAST KHASI HILLS",MEGHALAYA,19.4,4.5,7.1,196,15.5,11,48611,43333,2013
497,1427,"UMTREW AT BYRNIHAT EAST, MEGHALAYA",MEGHALAYA,23.7,7.2,7.1,107,6.7,5.56,303,476,2013
498,3366,"UMTREW RIVER AT UMRAN, RINAN BHOI",MEGHALAYA,22.7,7.5,7,82,2.1,3.02,45,122,2013
503,1403,"GUMTI AT U/S SOUTH TRIPURA,TRIPURA",TRIPURA,27.4,6.6,7.7,165,1.7,0,280,325,2013
504,1404,"GUMTI AT D/S SOUTH TRIPURA, TRIPURA",TRIPURA,21.9,6.7,7.8,167,4.8,1,440,520,2013
505,1726,"CHANDRAPUR, AGARTALA D/S OF HAORA RIVER, TRIPURA",TRIPURA,27.5,6.6,7.7,183,3.7,1.55,415,575,2013
506,1393,DAMANGANGA AT D/S OF MADHUBAN,DAMAN & DIU,31,7.1,7.8,151,8,0.08, , ,2012
507,1150,DAMANGANGA AT KACHIGAON U\S AT GIDC WIER,GUJARAT,28,7.2,7.4,319,0.7,0.18,5,10,2012
508,1865,RIVER DHADAR AT KOTHADA,GUJARAT,27,6.2,8.4,894,9,0.38,140,350,2012
509,1434,AMLAKHADI AFTER CONFL. OF W. WATER FROM ANKLESHWAR,GUJARAT,30,2.2,8,1835,17.9,0.86,10478,25478,2012
510,1980,AMLAKHADI AT PUNGAM ANKLESHWAR DISTT BHARUCH,GUJARAT,31,2,7.7,3165,32.3,3.44,11498,15173,2012
511,1149,KOLAK AT PATALIA BDG,GUJARAT,29,2.4,7.6,1500,6.2,1.31,3,13,2012
512,1399,ZUARI AT D/S OF PT. WHERE KUMBARJRIA CANAL JOINS,GOA,31,5.9,7.2,52,2.1,0.08, ,90,2012
513,1475,ZUARI AT PANCHAWADI,GOA,30,6.1,6.8,408,1.3,0.17,1300,3808,2012
514,3181,RIVER ZUARI AT BORIM BRIDGE,GOA,30,5.5,6.9,143,1.3,0.09,4100,11113,2012
515,3182,RIVER ZUARI AT MARCAIM JETTY,GOA,29,5.4,7.2,60,1.5,0.08,428,2309,2012
516,1400,MANDOVI AT NEGHBOURHOOD OF PANAJI,GOA,29,5.8,7.2,34,5.3,0.17,855,3322,2012
517,1476,"MANDOVI AT TONCA, MARCELA",GOA,29,5.9,6.7,125,1.5,0.14,1638,5793,2012
518,3185,MANDOVI AT AMONA BRIDGE,GOA,28,6.4,6.7,175,1.3,0.1,772,3636,2012
519,3186,RIVER MANDOVI AT IFFI JETTY,GOA,30,6.2,7.7,39,1.3,0.06,1296,4517,2012
520,3187,MANDOVI NEAR HOTEL MARRIOT,GOA,30,6.1,7.8,39,1.5,0.06,1032,5840,2012
521,1543,KALNA AT CHANDELNAN PERNEM,GOA,27,7.3,6.9,61,0.7,0.09,1430,4388,2012
522,1548,RIVER ASSONORA AT ASSONORA,GOA,28,6.8,6.6,71,1.5,0.14,2495,3949,2012
523,2276,"BICHOLIM VARAZAN NAGAR, BICHOLIM",GOA,29,7.4,6.5,129,2.3,0.49,5868,16691,2012
524,2275,"RIVER CHAPORA NEAR ALORNA FORT ,PERNEM",GOA,28,7,6.8,503,1.6,0.66,965,2404,2012
525,3189,RIVER CHAPORA AT SIOLIM,GOA,29,6.3,7.5,31,1.6,0.06,1466,4267,2012
526,1546,KHANDEPAR AT OPA NAN PONDA,GOA,29,7.1,6.8,70,0.8,0.17,716,3567,2012
527,2270,"KHANDEPAR AT CODLI NR BDG, U/S OPA WATERWORKS,SANGUEM",GOA,30,7.3,6.8,69,1.2,0.12,457,2446,2012
528,2272,"RIVER KUSHAWATI NEAR BUND AT KEVONA,RIVON,SANGUEM",GOA,28,6.7,6.6,118,1,0.22,1104,3496,2012
529,1545,RIVER MADAI AT DABOS NAN  VALPOI,GOA,28,7.4,6.8,80,1.3,0.06,274,1404,2012
530,2274,RIVER MAPUSA ON CULVERT ON HIGHWAY MAPUSANANPANAJI,GOA,29,4.5,6.6,250,2.4,0.16,1572,5889,2012
531,2271,"SAL PAZORKHONI, CUNCOLIM (NEAR CULVERT MARGAONAN CANACONA NATIONAL HIGHWAY)",GOA,28,6.1,6.9,74,1.8,0.19,1074,3937,2012
532,2273,"RIVER SAL NEAR HOTEL LEELA MOBOR,CAVELOSSIM",GOA,30,5.9,7.3,44,1.6,0.14,962,2794,2012
533,3183,"SAL AT KHAREBAND, MARGAO",GOA,30,2.4,6.5,195,4.8,0.35,7980,14217,2012
534,3184,"SAL AT ORLIM BRIDGE, ORLIM",GOA,31,4,6.8,207,1.8,0.34,818,2280,2012
535,3190,RIVER SINQUERIM (CANDOLIM SIDE NEAR BRIDGE),GOA,29,5.4,7.6,40,1.6,0.07,290,1330,2012
536,3191,RIVER SINQUERIM NEAR NERUL TEMPLE,GOA,30,5.3,7.6,41,1.4,0.08,952,2517,2012
537,1547,RIVER TALPONA AT CANACONA,GOA,29,7,6.9,54,0.8,0.21,667,3059,2012
538,3188,RIVER TIRACOL AT TIRACOL,GOA,29,5.9,7.7,44,2.1,0.08,1200,831,2012
539,1544,VALVANT AT SANKLI NAN BICHOLIM,GOA,29,7.1,6.5,60,1.7,0.13,2926,8163,2012
540,2651,"AMBA AT D/S OF WAKEN BRIDGENANU/S OF JS PETROCHEMICALS, WAKENPHATA, ROHA",MAHARASHTRA,29,6.9,7.7,99,3.3,0.56,53,123,2012
541,1461,BHATSA AT D/S OF PISE DAM NEAR PISE VILLAGE (ULHAS),MAHARASHTRA,30,6.6,7.9,123,3.2,0.52,44,104,2012
542,2653,"BHATSA AT D/S OF LIBERTY OIL MILLS, SATNEL, SHAHAPUR,THANE",MAHARASHTRA,27,6.6,7.7,220,3.6,0.65,25,77,2012
543,2654,"BHATSA AT U/S OF LIBERTY OIL MILLS, SATNEL, SHAHAPUR, THANE",MAHARASHTRA,27,6.8,7.7,219,3.4,0.63,23,75,2012
544,1092,KALU AT ATALE VILLAGE,MAHARASHTRA,27,4.8,7.2,5429,8.4,2.08,177,408,2012
545,2670,"KAN RIVER, NEAR SAKRI WATER WORKS, SAKRI, DHULE.",MAHARASHTRA,23,6.4,8,493,4.2,3.91,17,68,2012
546,1152,KUNDALIKA AT ROHA CITY,MAHARASHTRA,29,6.8,7.6,100,3,0.54,124,295,2012
547,2198,KUNDALIKA RIVER AT ARE KHURD ( SALINE ZONE ),MAHARASHTRA,29,6.7,7.5,316,4.6,0.6,47,132,2012
548,2671,"KUNDALIKA RIVER NEAR SALAV BRIDGE (SALINA ZONE), SALAV, ROHA, RAIGAD",MAHARASHTRA,28,5.8,7.9,37227,9.5,1.42,231,451,2012
549,2672,"KUNDALIKA AT DHATAV AT JACKWELL (DRINKING WATER  PUMPING STATIONNANSWEET ZONE), ROHA",MAHARASHTRA,29,6.9,7.7,84,3.1,0.42,69,168,2012
550,2168,MITHI RIVER,MAHARASHTRA,25,4.9,7.6,21254,55.5,2.18,560,964,2012
551,2676,"MUCHKUNDI RIVER AT  WAKED, NEAR M/S ASAHI INDIA GLASS LTD., LANJA, RATNAGIRI.",MAHARASHTRA,28,6.9,7.9,312,2.7,1.58,4,107,2012
552,1151,PATALGANGA AT SHILPHATA,MAHARASHTRA,29,6.8,7.5,146,3,0.6,124,241,2012
553,1462,PATALGANGA NEAR INTAKE OF MIDC W/W,MAHARASHTRA,29,6.7,7.3,127,2.9,0.59,100,209,2012
554,2685,"PATALGANGA RIVER AT D/S OF KHARPADA BRIDGE, RAIGAD.",MAHARASHTRA,29,5.6,6.9,432,4.5,1.72,58,173,2012
555,2686,"PATALGANGA RIVER AT VYAL PUMP HOUSE , KHALAPUR, RAIGAD.",MAHARASHTRA,29,6.5,7.3,126,3,0.59,132,284,2012
556,2687,"PATALGANGA RIVER AT KHALAPUR PUMPING STATION, KHALAPUR, RAIGAD.",MAHARASHTRA,30,7.1,7.5,128,3,0.6,136,297,2012
557,2688,"PATALGANGA RIVER AT SAVROLI BRIDGE, KHALAPUR, RAIGAD.",MAHARASHTRA,30,6.4,7.3,129,3.1,0.6,68,191,2012
558,2689,"PATALGANGA AT GAGANGIRI MAHARAJ TEMPLE, KHOPOLI, RAIGAD.",MAHARASHTRA,29,6.9,7.7,129,2.9,0.55,135,268,2012
559,2696,"PEHLAR DAM ON PEHLAR INLET OF WATER WORKS, VASAI, THANE.",MAHARASHTRA,25,7,7.9,153,2.9,0.55,30,86,2012
560,2199,SAVITRI RIVER AT OVALE VILLAGE.,MAHARASHTRA,30,6.4,7.6,10165,3.7,2.14,5,139,2012
561,2701,"SAVITRI JACKWELL AT UPSA KENDRE, NANGALWADI, MAHAD, RAIGAD",MAHARASHTRA,30,6.9,7.7,307,2.8,3.6,4,123,2012
562,2702,"SAVITRI RIVER AT SHEDAV DOH, MAHAD,RAIGAD",MAHARASHTRA,31,6.3,7.7,322,3.5,1.1,4,116,2012
563,2703,"SAVITRI RIVER AT DADLI BRIDGE, DADLI, MAHAD, RAIGADH",MAHARASHTRA,30,6.5,7.5,5835,3.4,1.72,4,126,2012
564,2704,"SAVITRI RIVER AT MUTHAVALI VILLAGE, MAHAD, RAIGADH",MAHARASHTRA,30,6.3,7.4,9245,4.7,2,4,134,2012
565,2706,"SURYA RIVER, U/S OF SURYA DAM, DHAMMI, VIKRAMGAD, THANE",MAHARASHTRA,28,6.5,8.1,1907,4,0.55,46,115,2012
566,2707,"SURYA AT MIDC PUMPING STN, GARVASHET, PALGHAR, THANE",MAHARASHTRA,28,7,8,1896,3.5,0.64,190,245,2012
567,2708,"SURYA RIVER AT INTAKE OF VASAINANVIRAR W/S SCHEME, MASVAN, PALGHAR, THANE",MAHARASHTRA,28,7,8,206,2.9,0.56,31,74,2012
568,2709,"TANSA RIVER NEAR ROAD BRIDGE, VILLAGE DAKEWALI, WADA, THANE",MAHARASHTRA,27,6.8,7.8,239,3.3,0.56,33,77,2012
569,1093,ULHAS AT U/S OF NRC BUND AT MOHANE,MAHARASHTRA,27,6.4,7.6,152,3.2,0.96,62,142,2012
570,1094,ULHAS AT U/S OF BADLAPUR,MAHARASHTRA,26,6.7,7.7,146,3,0.89,30,73,2012
571,2162,ULHAS ATJAMBHUL WATER WORKS,MAHARASHTRA,27,6.7,7.6,137,2.9,0.76,24,64,2012
572,2712,"VAITARNA NR RD BDG, GANDHARE VILLAGE, WADA, THANE.",MAHARASHTRA,28,6.6,7.8,228,3.5,0.57,30,79,2012
573,2164,VASHISTI AT U/S OF THREE M PAPER MILLS NEAR M/S MULTIFILMS PLASTIC PVT. LTD. AT KHERDI.,MAHARASHTRA,23,7,7.7,409,2.4,0.93,4,112,2012
574,2713,"VASHISHTI  AT D/S OF THREE M PAPER MILLS NR CHIPLUN WATER INTAKE JACKWELL,KHERDI,RATNAGIRI",MAHARASHTRA,22,6.8,7.6,263,2.9,0.81,4,123,2012
575,2714,"VASHISHTI RIVER AT U/S OF POPHALI NEAR KONPHANSAWANE BRIDGE, CHIPLUN, RATNAGIRI",MAHARASHTRA,23,6.9,7.5,338,2.3,3.93,4,108,2012
576,1342,ACHENKOIL AT THUMPAMON,KERALA,26,7,7.2,79,0.8,0.62,279,637,2012
577,1443,ACHENKOIL AT CHENNITHULA,KERALA,26,6.6,7,67,1.1,0.53,275,670,2012
578,3465,"ACHENKOIL AT KALLARAKADAVU, PATHANAMTHITTA",KERALA,26,6.6,7.3,59,0.7,0.57,281,541,2012
